id,enabled,name_en,short_name_en,name_zh,short_name_zh,name_zh_tw,short_name_zh_tw,name_ja,short_name_ja,timing,cost,accent,description_en,description_zh,description_zh_tw,description_ja,effect
gift:fool,1,The Fool,Fool,愚者,愚者,愚者,愚者,愚者,愚者,prepare_level,4,#f4a261,Copy the last used gift card except The Fool.,复制上一张已使用的礼品卡，但不能复制愚者本身。,複製上一張已使用的禮品卡，但不能複製愚者本身。,直前に使用したギフトカードを複製する。ただし愚者自身は除く。,"{""type"":""copy_last_used""}"
gift:priestess,1,The High Priestess,Priest,女祭司,祭司,女祭司,祭司,女教皇,司祭,prepare_level,5,#9b5de5,Create 2 random Playmats if there is room.,若有空位，生成 2 张随机卡垫。,若有空位，生成 2 張隨機卡墊。,空きがあればランダムなプレイマットを 2 枚生成する。,"{""type"":""spawn_random_playmats"",""count"":2}"
gift:emperor,1,The Emperor,Emperor,皇帝,皇帝,皇帝,皇帝,皇帝,皇帝,prepare_level,6,#ffb703,Create 2 random gift cards if there is room.,若有空位，生成 2 张随机礼品卡。,若有空位，生成 2 張隨機禮品卡。,空きがあればランダムなギフトカードを 2 枚生成する。,"{""type"":""spawn_random_giftcards"",""count"":2}"
gift:hermit,1,The Hermit,Hermit,隐者,隐者,隱者,隱者,隠者,隠者,prepare_level,6,#8ecae6,Gain chips equal to your current chips capped at +20.,获得等同于当前筹码数的筹码，上限 +20。,獲得等同於目前籌碼數的籌碼，上限 +20。,現在のチップと同量のチップを得る。上限は +20。,"{""type"":""double_money_cap"",""cap"":20}"
gift:judgement,1,Judgement,Judge,审判,审判,審判,審判,審判,審判,prepare_level,7,#06d6a0,Gain 1 random sleeve immediately if there is room.,若有空位，立即获得 1 个随机卡套。,若有空位，立即獲得 1 個隨機卡套。,空きがあればランダムなスリーブを 1 つ獲得する。,"{""type"":""add_random_sleeve"",""count"":1}"
